{"$schema":"https://json-schema.org/draft/2020-12/schema","type":"object","additionalProperties":false,"properties":{"registryVersion":{"const":6},"specId":{"const":"SPEC-0001"},"authorizationId":{"const":"phase-6/v1"},"operationFamilies":{"const":["guarded-http","protected-regression","runner-environment","screenshot","visible-role"]},"adapter":{"type":"object"},"fixtures":{"type":"array","minItems":3,"maxItems":3,"items":{"type":"object"}},"actions":{"type":"array","minItems":33,"maxItems":33,"uniqueItems":true,"items":{"type":"object","additionalProperties":false,"properties":{"actionId":{"type":"string"},"kind":{"enum":["visible-preview-cancel","visible-rejection","visible-apply-regression","visible-invalid-response","visible-project-switch","protected-regression"]},"caseId":{"type":["string","null"]}},"required":["actionId","kind","caseId"]}}},"required":["registryVersion","specId","authorizationId","operationFamilies","adapter","fixtures","actions"]}
