{
  "registryVersion": 6,
  "specId": "SPEC-0001",
  "authorizationId": "phase-6/v1",
  "operationFamilies": ["guarded-http","protected-regression","runner-environment","screenshot","visible-role"],
  "adapter": {"path":"scripts/spec0001-browser/actions/phase6.ts","byteLength":647,"sha256":"sha256:87e8fad1f9cfcba9cd8acf1b3fd558d924645304f3e49490003167c6838cf823"},
  "fixtures": [
    {"path":"scripts/fixtures/stick-ai/v2/stick-ai-intent-cases.json","byteLength":6107,"sha256":"sha256:afb5f1a88f8351d8e1319f0f1d961eebf20cd6917f8697d7860e7b0919b753f7"},
    {"path":"scripts/fixtures/stick-ai/v2/stick-ai-ui-cases.json","byteLength":2051,"sha256":"sha256:d46e98a6d7af70f1b11506ffc741e52afd6ff9cf2d9ad3f466902d506e138fe4"},
    {"path":"scripts/fixtures/stick-ai/v2/stick-ai-creator-preservation-cases.json","byteLength":1202,"sha256":"sha256:6f688b7a6ed75973aae78f042f2d9e7dc68029e6476bb9bee1f037eaa2f16efb"}
  ],
  "actions": [
    {"actionId":"accepted-A01","kind":"visible-preview-cancel","caseId":"A01"},
    {"actionId":"accepted-A02","kind":"visible-preview-cancel","caseId":"A02"},
    {"actionId":"accepted-A03","kind":"visible-preview-cancel","caseId":"A03"},
    {"actionId":"accepted-A04","kind":"visible-preview-cancel","caseId":"A04"},
    {"actionId":"accepted-A05","kind":"visible-preview-cancel","caseId":"A05"},
    {"actionId":"accepted-A06","kind":"visible-preview-cancel","caseId":"A06"},
    {"actionId":"accepted-A07","kind":"visible-preview-cancel","caseId":"A07"},
    {"actionId":"accepted-A08","kind":"visible-preview-cancel","caseId":"A08"},
    {"actionId":"accepted-A09","kind":"visible-preview-cancel","caseId":"A09"},
    {"actionId":"accepted-A10","kind":"visible-preview-cancel","caseId":"A10"},
    {"actionId":"accepted-A11","kind":"visible-preview-cancel","caseId":"A11"},
    {"actionId":"accepted-A12","kind":"visible-preview-cancel","caseId":"A12"},
    {"actionId":"accepted-A13","kind":"visible-preview-cancel","caseId":"A13"},
    {"actionId":"accepted-A14","kind":"visible-preview-cancel","caseId":"A14"},
    {"actionId":"accepted-A15","kind":"visible-preview-cancel","caseId":"A15"},
    {"actionId":"reject-R01","kind":"visible-rejection","caseId":"R01"},
    {"actionId":"reject-R05","kind":"visible-rejection","caseId":"R05"},
    {"actionId":"reject-R10","kind":"visible-rejection","caseId":"R10"},
    {"actionId":"reject-R12","kind":"visible-rejection","caseId":"R12"},
    {"actionId":"reject-R17","kind":"visible-rejection","caseId":"R17"},
    {"actionId":"reject-R19","kind":"visible-rejection","caseId":"R19"},
    {"actionId":"reject-R22","kind":"visible-rejection","caseId":"R22"},
    {"actionId":"reject-R24","kind":"visible-rejection","caseId":"R24"},
    {"actionId":"reject-R26","kind":"visible-rejection","caseId":"R26"},
    {"actionId":"reject-R29","kind":"visible-rejection","caseId":"R29"},
    {"actionId":"reject-R30","kind":"visible-rejection","caseId":"R30"},
    {"actionId":"reject-R31","kind":"visible-rejection","caseId":"R31"},
    {"actionId":"reject-R35","kind":"visible-rejection","caseId":"R35"},
    {"actionId":"apply-once","kind":"visible-apply-regression","caseId":"A01"},
    {"actionId":"invalid-response","kind":"visible-invalid-response","caseId":"A01"},
    {"actionId":"project-switch","kind":"visible-project-switch","caseId":"A01"},
    {"actionId":"creator-back","kind":"protected-regression","caseId":null},
    {"actionId":"drawing-generate","kind":"protected-regression","caseId":null}
  ]
}
